{
  "contract_id": "SF-CON-DISCOVERY-QUERY",
  "contract_status": "FROZEN",
  "freeze_status": "FROZEN",
  "tenant_id": "11111111-1111-4111-8111-111111111111",
  "query_id": "44444444-4444-4444-8444-444444444444",
  "filters": {
    "jurisdiction_codes": ["IN-OD"],
    "service_codes": ["RESIDENCE_CERTIFICATE"],
    "keywords": ["residence"]
  },
  "catalogue_version_id": "55555555-5555-4555-8555-555555555555",
  "pagination": {
    "limit": 20,
    "offset": 0
  },
  "result_is_non_statutory": true
}
